{
  "schema_version": 2,
  "scenario_id": "b7-s1-g1",
  "deal_type": "vm",
  "provisioning": "real-kvm-ansible",
  "gpu_assignment": "whole-device-passthrough",
  "physical_capacity": {
    "independently_assignable_gpus": 1,
    "gpus_per_successful_vm": 1
  },
  "actor_slots": {
    "observers": ["observer-1"],
    "buyers": ["buyer-1", "buyer-2", "buyer-3", "buyer-4", "buyer-5", "buyer-6", "buyer-7"],
    "sellers": ["seller-1"],
    "host_operators": ["host-operator-1"]
  },
  "actor_counts": {
    "observers": 1,
    "buyers": 7,
    "sellers": 1,
    "host_operators": 1
  },
  "listing_topology": {
    "capacity_authority_mode": "single-seller",
    "sellers": [
      {
        "seller_slot": "seller-1",
        "service_slot": "seller-service-1",
        "listing_slots": ["listing-1"]
      }
    ]
  },
  "load_counts": {
    "selected_listings": 1,
    "requests": 7
  },
  "requests": [
    {"request_id": "request-1", "buyer_slot": "buyer-1", "seller_slot": "seller-1", "listing_slot": "listing-1"},
    {"request_id": "request-2", "buyer_slot": "buyer-2", "seller_slot": "seller-1", "listing_slot": "listing-1"},
    {"request_id": "request-3", "buyer_slot": "buyer-3", "seller_slot": "seller-1", "listing_slot": "listing-1"},
    {"request_id": "request-4", "buyer_slot": "buyer-4", "seller_slot": "seller-1", "listing_slot": "listing-1"},
    {"request_id": "request-5", "buyer_slot": "buyer-5", "seller_slot": "seller-1", "listing_slot": "listing-1"},
    {"request_id": "request-6", "buyer_slot": "buyer-6", "seller_slot": "seller-1", "listing_slot": "listing-1"},
    {"request_id": "request-7", "buyer_slot": "buyer-7", "seller_slot": "seller-1", "listing_slot": "listing-1"}
  ],
  "expected_outcomes": {
    "vm-succeeded": 1,
    "capacity-refused": 6,
    "fault": 0
  },
  "retry_budget": 0
}
